{
  "run_id": "benchmark-002",
  "repo_path": "/Users/gillettes/Coding Projects/.codex-worktrees/gillette-website-gil30-benchmark-clone",
  "objective": "Track the contact-lead source across the Gillette website so submissions identify whether they came from the header CTA, homepage quick-quote, or dedicated contact page.",
  "scope": {
    "allowed_paths": [
      "client/src/pages/site/",
      "client/src/lib/",
      "server/",
      "shared/",
      "tests/e2e/"
    ],
    "forbidden_paths": [
      "scripts/",
      "client/src/components/"
    ]
  },
  "acceptance": {
    "functional": [
      "Contact and estimate submissions include a stable source identifier in the API payload.",
      "The server preserves the source field in the stored or forwarded lead payload.",
      "The feature does not break existing lead submission flows."
    ],
    "quality_gates": [
      "pnpm check passes.",
      "pnpm test:unit passes.",
      "pnpm test:smoke passes."
    ],
    "ui_checks": [
      "The contact form still submits successfully from /contact.",
      "The estimate form still submits successfully from /estimate.",
      "No console errors appear on the touched lead forms."
    ]
  },
  "constraints": {
    "single_writer": true,
    "auto_push": false,
    "auto_merge": false,
    "max_repair_loops": 4,
    "max_iterations": 45,
    "max_cost_dollars": 10.0,
    "hard_timeout_seconds": 2400
  }
}
